{
  "schema_id": "trix.test-evidence",
  "schema_version": "0.2",
  "evidence_id": "example-not-run-evidence",
  "test_case_id": "RT-01",
  "requirement_ids": [
    "RUN-001",
    "RUN-002",
    "RUN-006"
  ],
  "result": "not-run",
  "recorded_at": "2000-01-01T00:00:00Z",
  "scope": {
    "kind": "RUNTIME",
    "profile_refs": [
      "profile:DIST"
    ],
    "target_refs": [],
    "artifact_revision_ref": "revision:example-unimplemented-runtime"
  },
  "execution": null,
  "artifacts": [],
  "summary": "This is a planned acceptance case, not an executed runtime test. The companion package only validates this record's shape and selected invariants.",
  "applicability": {
    "status": "APPLICABLE",
    "rationale": "Applicable to a future implementation exposing distributed task observations."
  },
  "metadata": {
    "org.trix.example": "Illustrative proposed record only. No task ran, authority was verified, or platform was qualified."
  }
}
